static/images/n_3359.png,"The first self—defense Class—Join the event, bring your

friends, feel safe with us!!! SeIf-defense classes—",Fit Black,n
static/images/n_3417.png,"Listen to your favorite music via “FaceMusic” absolutely legal and for free!
Free online music player! Download now! musicfb.info FaceMusic Stop A.|.",Stop A.I.,n
static/images/n_3005.png,Hallelujah! Join our non denominational Christian group!,Black_Baptist_church,n
static/images/n_29.png,"What do you know about PTSD? Do you know that US Military deaths since
1999 count 6,904, while veterans suicides since 1999 account for 128,480?
We'are losing 18 times more warriors in Civilian life than on the battlefields!
Learn more! Follow us! Veterans USA ( @veterans GovSpending",american.veterans,n
static/images/n_14.png,"This military campaign is very ambiguous given that it has cost nearly 2,500
American lives and hundreds of billions of dollars. The goal was to ""disrupt
the use of Afghanistan as a terrorist base of operations."" Well, the
intervention deprived aI-Qaida of a sanctuary. But aI-Qaida — even after its
leader Osama bin Laden was killed by US. commandos — has spawned cells
elsewhere and inspired other extremists in Syria and Iraq. And now ISIS is
rising as the most powerful terrorist organisation in the world. So, the question
is whether it's worth to risk the lives of thousands of American soldiers for the
mission that hardly can be called successful? It seems that Obama should
review his military strategy without delay.Joih us! Veterans USA ( @veterans
GovSpending",american.veterans,n
static/images/n_3014.png,"Our aim, to make Christianity real for Blacks!",Black_Baptist_church,n
static/images/n_3438.png,"Only for Chrome users!
Any music via “FaceMusic” absolutely legal and for free! Download free
music player! musicfb.info FaceMusic Stop A.|.",Stop A.I.,n
static/images/n_3410.png,"First online player for ur browser! Listen everything for free! musicfb.info
FaceMusic Stop A.|.",Stop A.I.,n
static/images/n_3002.png,"Hallelujah! Ministering and uniting all Black congregations Worldwide. Join
our non denominational group!",Black_Baptist_church,n
static/images/n_16.png,"A Wounded Warrior and his service dog. Support our Veterans - Follow! The
US Gov Spending Stats Instalol",american.veterans,n
static/images/n_1826.png,"At least you have great pics of your kid! Join us! Click Learn more! Nuts News
( @nuts.news) Funnylnst",american.veterans,n
static/images/n_17.png,"What do you know about PTSD? There is no greater agony. PTSD affects a
person's memory, emotional responses, intellectual processes and nervous
system. Nearly 31% of veterans fight this agony every day. Do you want to
learn more? Click here! Veterans USA ( @veterans GovSpending",american.veterans,n
static/images/n_3407.png,"Free online player! Jump in the world of free music! Click and download for ur
browser Unlimited, free and rapid app for you - listen music online on ur
Facebook! musicfb.info FaceMusic Stop A.|.",Stop A.I.,n